,title,url,mood,lyric
0,今,http://utaten.com/lyric/%E9%96%A2%E3%82%B8%E3%83%A3%E3%83%8B%E2%88%9E/%E4%BB%8A/,gennki,"
いつまでも此処に居たいけれども
旅立つ夢を見てしまったことを

貴方に祈りを捧げるよ
さよならまたいつか会うまで

夢を見たから胸の中から
手を伸ばし君の肩を叩くから
いつか目の前たどり着けたら
くだらないことで笑い合えるかな
未来を作る 今 今 今

見つめても見えないものがあると
聞こえない声を聞こうとしては

彼方に光を感じるよ
おはよう また会えた ほんとさ

夢の中から水の底から
手を伸ばし君の掌つないだ
いつか目の前たどり着けたら
苦い思い出を笑える頃かな
未来を越える 今 今 今

風が今 強くなる
日が落ちるその前に
君の声思い出したら
さあ 時に乗る

夢を見たから胸の中から
手を伸ばし君の肩を叩くから
いつか目の前たどり着けたら
くだらないことで笑い合えるかな
未来を作る 今 ほら

夢の中から水の底から
手を伸ばし君の掌つないだ
いつか目の前たどり着けたら
善い思い出を笑える頃かな
未来を越える今今今
ほら 今 今 今
"
