,title,url,mood,lyric
0,AGAKU(TV アニメ『カイトアンサ』エンディング主題歌),http://utaten.com/lyric/SuG/AGAKU/,gennki,"
3-6-5-0 days から派生してくnext phase
振り返る あどけない時代のface
理性 不携帯 掌 掴んだ pieces of dream with lots of scream
根拠なしpride 眼前white out 道標は衝動

ほらSTEP STEP STEP STEP
どうせ倒れるなら前へ 病的な挑戦欲求
飽くなき魂が魅せた物語は
喜劇かそれとも悲劇か

ひとよりも欲張りだから
まだまだ叶えたりない夢ばかりだな

ぼくらは綱渡りだった 傷だらけだった そして未来もそうであれ
それがただの虚仮威しでも 間違いでも 真実にする為に足掻くだけ

怖いもんひとつもない そんな台詞言ってみたい
今すぐ逃げ出したい でもみんなを裏切れない
正解はeasy と言えない空気
苦肉の策 破棄 吐き足りない覇気
背水の陣だからこその価値

ほらPRAY PRAY PRAY PRAY
どうせ叶えるなら理想 病的な表現欲求
性懲りもなく彷徨い続けた舞台は 栄光かそれともリアルか

払ってきた犠牲の価値
そんなの考える暇もなかったんだ

僕らは泳ぎ続けてないと 息が吸えなかった 捨てるものが選べなくて
愚か者で不格好でも 決して消えない 爪痕を残してやるだけさ

ぼくらは綱渡りだった 傷だらけだった そして未来もそうであれ
たとえ女神に見放されても 口説き落として また惚れさせてやるからさ

綱渡りだろうが 傷だらけだろうが 変わらず明日を生きてゆけ
それがただの虚仮威しでも 間違いでも 真実にする為に足掻くだけ
"
