,title,url,mood,lyric
0,Make You Mine,http://utaten.com/lyric/GENERATIONS+from+EXILE+TRIBE/Make+You+Mine/,rennai,"
自分でも理解できないほどに
胸の奥がざわつく Can't you see
気分次第で変わる表情に
It's driving me crazy 抵抗できない

絶妙で微妙なディスタンスで
Now come on, come on
溶けそうになる My mind
我慢できない
それなら強硬手段で
そう君を連れ出して・・・

このまま Make you mine
今までに見たことない景色見せてあげる
どこまでも Tonight
僕に身を任せて 鼓動のBPM上げて
弾けるように Up & down から Side 2 side
ここから僕ら次第
Move ya, groove ya
連れてく Make you mine

もっと求めあって
そう触れあって
心拍数がGo Upして
離れられない Close to you, so deep into you
Let's get down tonight

ねぇ君が欲しいものは全て
わかってるから Don't you walk away
意思の強い眼差しの中へと
迷い込んでエスケープできない

逃避行は想像よりイージーで
Now come on, come on
走り出してしまえば
我慢しないで
今なら衝動のまま
2人でアクセル踏んで・・・

このまま Make you mine
今まで感じたことないフィーリングを感じてる
どこまでも Tonight
波に身を委ねて これは L-O-V-E ?
駆けめぐる Up & down から Side 2 side
君は My lucky star
Move ya, groove ya
連れてく Make you mine

Try me... その Pretty brown eyes
Love me... 溺れてしまいそう
100... 君にあげるから
もっと、そうもっと そばに来て

このまま Make you mine
今までに見たことない景色見せてあげる
どこまでも Tonight
僕に身を任せて 鼓動のBPM上げて
弾けるように Up & down から Side 2 side
ここから僕ら次第
Move ya, groove ya
連れてく Make you mine

I'mma make you mine...
I'mma make you mine...
"
