,title,url,mood,lyric
0,SSW,http://utaten.com/lyric/%E3%82%B3%E3%83%AC%E3%82%B5%E3%83%AF/SSW/,rennai,"
いまね 幸せな気分
昔付き合った君を思い出す
ほらね 都合がいいでしょ？
こんな生き方しかできないけど

辛かった別れはあたしをほんの少しだけど
可愛くねしてくれたんだと思っている

そんなあたしはシンガーソングライター
君にフラれたくらいで
生きる意味なくしたりしないよ全部ネタにするから
君にたくさん大好きと 伝えてたこの声で歌うの

君が乾かしてくれる
髪はいつもサラサラ不思議だった
あの頃は気付けなかった
ありがとうちゃんと愛してくれて

甘い夜に語りあった夢覚えてますか？
君はもう叶えたのかな 気になっている

そうよあたしはシンガーソングライター
君に話してた夢が
ひとつ叶ったんだよってどうにか伝えたいのに
アドレスはどこにもないわ あの時の強がりのせいで

そんなあたしはシンガーソングライター
あの時のライブみたいに
ステージの上で泣いたりしないもう一人じゃないから
今 君は幸せですか？

そうよあたしはシンガーソングライター
君に話してた夢が
ひとつ叶ったんだよってどうにか伝えたいから
いまここで夢を歌うわ
この声が 探してる
君にまで 届くといいな
"
