,title,url,mood,lyric
0,S級パラダイス(B-project キャラクターソングCD),http://utaten.com/lyric/B-Project/S%E7%B4%9A%E3%83%91%E3%83%A9%E3%83%80%E3%82%A4%E3%82%B9/,rennai,"
ラブシーンには キミが必要 この世界は S級パラダイス

ストリート賑やかだね こんなんじゃノリ悪いかな?
言葉が途切れたまま 沈黙の答え探した

確かめ合った×ラブ&ドリーミン
色褪せない×未来
孤独じゃない× In your eye's
ボクだけの× Face to Face

限界?なんて
そんな言葉ナンセンス
取り戻せ愛のパワー
あの場所あの日のミュージック 聴かせて!

I will be with you 星降る夜に
I will be with you 約束した
I will be with you 全部守りたい
数え切れない 涙も笑顔も

月明かりの下で とわに愛を語り合おうよ
世界中が嫉妬しそうな 目立つ場所でキスしよう

ラブシーンには キミが必要 この世界は S級パラダイス

パーティーとか苦手なタイプの キミは抜け出したくない?
目が合う仕草だけで 強引にさらってみる

狂おしい歌×ラプソディ
近いのに×遠くて
心の奥×閉ざした
秘密のキー×パスコード

キュートなスマイル
悩ましいボディライン
何度でも見つめたい
キミだけに捧げたい レボリューション!

I will be with you 二人で描いた
I will be with you 未来予想
I will be with you 全部叶えたい
乗り越えていけると信じて

刺激的で 奇跡的な あの出会いは運命
禁断の壁なんか越えて 甘い蜜に溶け合おう

ラブシーンには キミが必要 この世界は S級パラダイス

呆れるほどに 君への好きが
一秒ごと 高まってく
S級のラブパワー!
もう止められない

I will be with you 星降る夜に
I will be with you 約束した
I will be with you 全部守りたい
数え切れない 涙も笑顔も

月明かりの下で とわに愛を語り合おうよ
世界中が嫉妬しそうな 目立つ場所でキスしよう

ラブシーンには キミが必要 この世界は S級パラダイス
"
