,title,url,mood,lyric
0,今僕のいる場所が理想と違っても,http://utaten.com/lyric/Yun%2Achi/%E4%BB%8A%E5%83%95%E3%81%AE%E3%81%84%E3%82%8B%E5%A0%B4%E6%89%80%E3%81%8C%E7%90%86%E6%83%B3%E3%81%A8%E9%81%95%E3%81%A3%E3%81%A6%E3%82%82/,kando,"
何かを始めるのに 遅いとかないよ
だって可能性は信じなきゃ 生まれない
見ないふり 言い訳したってさ
何が大事かってことくらい
僕が一番知ってるから

何かを手にしたら
何か捨てなきゃいけない
そう僕は思わない 思わない
例え不確かな未来でも
手にしたいって強い気持ちなら
きっと変えていけるよ 何度でも

今僕のいる場所が 理想と違っても
今君のいる場所が 理想と違っても
そこには きっと 意味があるはず
そう想えたら この一瞬も愛おしい

今目の前の扉の向こう側に
新しい明日が僕らを待っている
良いことばかり ある訳ないけど
変わりたいから 扉を開くんだ

夕暮れの街に伸びる影がポツリと
感情も無いのに どうして？ 寂しそう...
大きいキャンバス代わりに
理想の自分 描いたら
気持ちがふと 楽になった

僕らが思うより 僕らは強いけど
時には弱くても 良いんだよ
痛み知らず優しさを 得られる筈なんてないから
今は大丈夫だよ ありのままで

心折れそうな時は思い出して
心ある人が支えてくれたよね
どんな時でも 言葉なくても
優しさで包み込んでくれたね

今僕も同じように誰かのために
今君も同じように誰かのために
寄り添うことで 分かち合えたら
勇気がほら 心を繋ぐんだ

幼い頃から 沢山の疑問符と
にらめっこしてた いつか同時に
そして一緒に笑い合えたら
悩みなんてもう 吹き飛ぶのに

今僕のいる場所が 理想と違っても
今君のいる場所が 理想と違っても
そこには きっと 意味があるから
可能性は無限大なんだよ

今目の前の扉の向こう側に
新しい世界を期待する明日が
良いことだけを イメージできたら
きらめく予感 扉を開くんだ
"
