,title,url,mood,lyric
0,半径10メーターの世界(防衛省「自衛官募集 2016」タイアップソング),http://utaten.com/lyric/%E3%82%A4%E3%83%88%E3%83%B2%E3%82%AB%E3%82%B7/%E5%8D%8A%E5%BE%8410%E3%83%A1%E3%83%BC%E3%82%BF%E3%83%BC%E3%81%AE%E4%B8%96%E7%95%8C/,gennki,"
放課後 回し飲みしたコーラ
夕暮れに溶け行く笑い声
ベッドの上 浮かぶ今日のことは
何故か他愛の無い景色だ

半径10メーターの世界でも構わない
石ころみたいな 愛おしい日々よ

当たり前が当たり前で在り続ける為に今
僕は僕が出来ることを少しずつ探してみよう
「ただいま」とか「おはよう」とかそんな些細な言葉が
何ものにも替え難いとなんとなくね思ったんだ

ぼんやり眺めていたテレビに
映った見知らぬ国の悲劇
悲しみに暮れる少女のこと
僕は何一つ知らない

人それぞれの営みが繋がり合い
この世は出来てる もしそうであれば

僕の前で笑う君の 支えてくれたあなたの
幸せな未来の為に 精一杯生きてみよう
そんなちっぽけな決意が 誰かにほら伝わって
海の向こうへ届いたら 何かが変わるかもしれない

「地球を救うヒーロー」なんて
大それた事は言わないさ
ただこのありふれた日々を守りたい
守りたい

当たり前が当たり前で在り続ける為に今
僕は僕が出来ることを少しずつ探してみよう
「ただいま」とか「おはよう」とかそんな些細な言葉が
何ものにも替え難いとなんとなくね思ったんだ
明日も今日と変わらずに
僕が僕でいられるように
"
