,title,url,mood,lyric
0,抱きしめたい,http://utaten.com/lyric/%E5%B5%90/%E6%8A%B1%E3%81%8D%E3%81%97%E3%82%81%E3%81%9F%E3%81%84/,rennai,"
不機嫌な顔がほらまた どうして そんなつもりじゃないのに
どうでもいいようなこどなら もっと上手くできるのに

陽射しの中に吹く風が そっど音を鳴らした
時間が止まったようなままでずっと 胸が痛む

戸惑ってるのは 大切だから 太陽が照りつける
ひとつだけ 言い訳させて
すれ違うDays l just feel your heart

何を言ったって絡まって空回りで… 焦っちゃいないさ
冷静になって何度もシミュレーション その心解いて

忙しいことを理由にして 甘え過ぎてたね
その見返りが少し大きくて 胸が痛む

抱きしめたいのに 大切なのに 単純に躊躇ってる
渇く喉 飲み込んだのは
やるせないMy heart l just feel your love

言葉が足りなくて 不安にさせる当然のYour theory
この想い見せられたら 一瞬ですべて変わっていくはずさ

戸惑ってるのは 大切だから 太陽が照りつける
ひとつだけ 言い訳させて
すれ違うDays l just feel your heart

抱きしめたいのに 大切なのに 単純に躊躇ってる
渇く喉 飲み込んだのは
やるせないMy heart こんなはずじゃ…
すれ違うDays l just feel your love
"
