,title,url,mood,lyric
0,Stupid ～真っ赤なブレスレット～,http://utaten.com/lyric/GENERATIONS+from+EXILE+TRIBE/Stupid+%EF%BD%9E%E7%9C%9F%E3%81%A3%E8%B5%A4%E3%81%AA%E3%83%96%E3%83%AC%E3%82%B9%E3%83%AC%E3%83%83%E3%83%88%EF%BD%9E/,rennai,"
曇ったガラスを 指でなぞったら
水滴散らかしながら 一本の線ができる You know
こんなふうに瞬間で みまくった My heart
透き通れば 綺麗になれば 楽なのに

まるでわざとみたい真っ赤な ブレスレット忘れて
消えたね あなたは…Ahhh

ちゃんと愛されてたからそう あんな好きだったんだって
Too late to regret 今更気づき バカすぎて笑えるよ
I'm stupid stupid 僕があなたにあげた
全部 全部 全部 その瞳から落ちてたね


すっかり冷めている デリバリーしたPizza
一人分の量とか わかんなくなってるんだ You know
何もかもをあなたが やってくれていたからさ
今の僕は笑い方さえ 憶えてないよ

ベッドサイドにある真っ赤な ブレスレット痛いよ
会いたい 会えない…Ahhh

孤独があなた捜しても あなたは何処にもいなくて
Too late to regret 途方に暮れた バカすぎて怖くなる
I'm stupid stupid 別れを決めていいのは
絶対 絶対 絶対 傷が深いあなたの方さ


こんな哀しみとか こんなやるせなさを
教えてくれてありがとう Oh
あのときあなたが どんな想いで 泣いていたのか 同じ想いになってわかる
I know I know I know I know, but it's too late

ちゃんと愛されてたからそう あんな好きだったんだって
Too late to regret 今更気づき バカすぎて笑えるよ
I'm stupid stupid 僕があなたにあげた
全部 全部 全部 その瞳から落ちてたね
I'm so stupid...
"
