,title,url,mood,lyric
0,Tomorrow will be a good day,http://utaten.com/lyric/E-girls/Tomorrow+will+be+a+good+day/,gennki,"
(Foo Wow...Good day)
Tomorrow will be a good day
明日はきっといい日よ

ひとりでも大丈夫 まだまだ頼りないけど
あなたにね出逢った頃より 私は強い

夏空に (浮かぶ白い雲が) 鮮やかで (パフェのクリームの色みたい綺麗)
ガラスの器の中 重ねてみる 夢・未来・希望そして次の恋

誰かを捜して 泣いていた私を
あなただけ見つけてくれた 愛してくれたの
最後に優しいキスをしてサヨナラ
大好きなまま バイバイ

あなたにはあなたのね 目指してる場所がある
私にも私が行きたい ところがあるわ

そうねきっと永遠の別れじゃない

ありがとうありがとう 何度でも言わせて
それ以外言葉ひとつも 思い浮かばない
背中を押すのは 今度は私なの
いつか偶然に 逢いたい

Tomorrow will be a good day
明日はきっといい日よ

誰かを捜して 泣いていた私を
あなただけ見つけてくれた 愛してくれたの
ありがとうありがとう 何度でも言わせて
それ以外言葉ひとつも 思い浮かばない
背中を押すのは 今度は私なの
いつか偶然に 逢いたい
大好きなまま バイバイ
"
